{
  "proposalId": "WG-PROPOSAL-0001",
  "risk": "LOW",
  "operation": "update_status_message",
  "status": "PROPOSED",
  "target": ".codex/hooks.json",
  "expectedSha256": "0000000000000000000000000000000000000000000000000000000000000000",
  "failingTest": true,
  "fullTestsPassed": true,
  "testEvidence": [
    ".agents/skills/orchestrating-workers-group/tests/test_skill_doctor.py"
  ],
  "qaEvidence": [
    ".agents/skills/orchestrating-workers-group/tests/test_self_improvement.py"
  ],
  "qaVerdict": "PASS",
  "bossReview": "APPROVED",
  "version": "1.0.1",
  "changelog": "Clarify a verified Hook display label.",
  "oldValue": "打工人集團｜舊",
  "newValue": "打工人集團｜新"
}
